PPL 415; 2983819947; Michael Paulo Cevallos Gomez; 44; 23; 22/09/2024; 22/09/2047; 23; 3(C); C65; Medio; 2 Hora(s); Evacion de Impuestos
PPL 416; 4458863924; Pedro Sergio Perero Morales; 44; 29; 14/05/1999; 14/05/2028; 4; 3(C); C66; Medio; 2 Hora(s); Fraude
PPL 417; 3573162940; Michael Julian Cevallos Ramirez; 55; 37; 20/07/1991; 20/07/2028; 4; 3(C); C67; Medio; 2 Hora(s); Hurto
PPL 418; 6087386896; Fabian Julian Garcia Morales; 42; 24; 10/11/2005; 10/11/2029; 5; 3(C); C68; Medio; 2 Hora(s); Robo
PPL 419; 8143734095; Mario Pablo Romero Hidalgo; 50; 27; 07/07/2003; 07/07/2030; 6; 3(C); C69; Medio; 2 Hora(s); Hurto
PPL 420; 7698910684; Gonzalo Adrian Torres Sanchez; 43; 29; 13/07/2001; 13/07/2030; 6; 3(C); C70; Medio; 2 Hora(s); Hurto
PPL 421; 8649618053; Fabian Angel Guerrero Ramirez; 48; 32; 30/03/1996; 30/03/2028; 4; 3(C); C71; Medio; 2 Hora(s); Fraude
PPL 422; 2852897460; Dario Sergio Paredes Sanchez; 55; 41; 13/08/1988; 13/08/2029; 5; 3(C); C72; Medio; 2 Hora(s); Robo
PPL 423; 8994173224; Gonzalo Sergio Paredes Ramirez; 43; 26; 06/11/2000; 06/11/2026; 2; 3(C); C73; Medio; 2 Hora(s); Fraude
PPL 424; 5553824838; Gonzalo Julian Gonzales Morales; 60; 41; 24/08/1986; 24/08/2027; 3; 3(C); C74; Medio; 2 Hora(s); Hurto
PPL 425; 9362134256; Pedro Diego Guerrero Reyes; 37; 22; 27/11/2007; 27/11/2029; 5; 3(C); C75; Medio; 2 Hora(s); Hurto
PPL 426; 2277737706; Carlos Antonio Perero Hidalgo; 36; 17; 27/05/2009; 27/05/2026; 2; 3(C); C76; Medio; 2 Hora(s); Fraude
PPL 427; 3069395419; Victor Cesar Paredes Sanchez; 59; 39; 05/02/1987; 05/02/2026; 2; 3(C); C77; Medio; 2 Hora(s); Fraude
PPL 428; 9226287343; Mario Pablo Torres Sanchez; 61; 45; 17/09/1983; 17/09/2028; 4; 3(C); C78; Medio; 2 Hora(s); Evacion de Impuestos
PPL 429; 7027268387; Pedro Antonio Gonzales Roman; 43; 22; 26/11/2007; 26/11/2029; 5; 3(C); C79; Medio; 2 Hora(s); Hurto
PPL 430; 9512458955; Gonzalo Pablo Cevallos Sanchez; 34; 28; 01/05/2013; 01/05/2041; 17; 3(C); C80; Medio; 2 Hora(s); Evacion de Impuestos
PPL 431; 8406793884; Roberto Adrian Cuenca Ramirez; 50; 34; 28/08/1994; 28/08/2028; 4; 3(C); C81; Medio; 2 Hora(s); Hurto
PPL 432; 8022599757; Dario Adrian Paredes Hidalgo; 47; 29; 12/08/2011; 12/08/2040; 16; 3(C); C82; Medio; 2 Hora(s); Robo
PPL 433; 2073323685; Dario Julian Torres Sanchez; 46; 17; 06/05/2010; 06/05/2027; 3; 3(C); C83; Medio; 2 Hora(s); Hurto
PPL 434; 6266473211; Gonzalo Sergio Cuenca Espinosa; 42; 30; 15/06/2011; 15/06/2041; 17; 3(C); C84; Medio; 2 Hora(s); Hurto
PPL 435; 6741331588; Mario Antonio Romero Ramirez; 48; 32; 31/12/1995; 31/12/2027; 3; 3(C); C85; Medio; 2 Hora(s); Fraude
PPL 436; 5459019504; Victor Antonio Guerrero Morales; 29; 6; 13/06/2019; 13/06/2025; 1; 3(C); C86; Medio; 2 Hora(s); Hurto
PPL 437; 1582885336; Pedro Antonio Paredes Rivera; 30; 15; 14/05/2015; 14/05/2030; 6; 3(C); C87; Medio; 2 Hora(s); Evacion de Impuestos
PPL 438; 4033997565; Roberto Julian Torres Sanchez; 54; 38; 23/08/1990; 23/08/2028; 4; 3(C); C88; Medio; 2 Hora(s); Robo
PPL 439; 2099287888; Roberto Adrian Gonzales Rivera; 62; 46; 28/10/1981; 28/10/2027; 3; 3(C); C89; Medio; 2 Hora(s); Robo
PPL 440; 5496782652; Dario Sergio Garcia Espinosa; 39; 26; 29/10/2004; 29/10/2030; 6; 3(C); C90; Medio; 2 Hora(s); Hurto
PPL 441; 3296898313; Dario Pablo Paredes Espinosa; 48; 26; 19/07/2010; 19/07/2036; 12; 4(D); D1; Bajo; 4 Hora(s); Escandalo Publico
PPL 442; 5651449931; Carlos Sergio Cuenca Espinosa; 49; 29; 26/02/1997; 26/02/2026; 2; 4(D); D2; Bajo; 4 Hora(s); Escandalo Publico
PPL 443; 7584579936; Fabian Adrian Cuenca Rivera; 49; 32; 19/06/1996; 19/06/2028; 4; 4(D); D3; Bajo; 4 Hora(s); Invacion de Propiedad Privada
PPL 444; 1028972751; Carlos Sergio Garcia Roman; 44; 16; 07/08/2010; 07/08/2026; 2; 4(D); D4; Bajo; 4 Hora(s); Invacion de Propiedad Privada
PPL 445; 4267215123; Victor Angel Paredes Sanchez; 28; 9; 23/05/2018; 23/05/2027; 3; 4(D); D5; Bajo; 4 Hora(s); Escandalo Publico
PPL 446; 9531838289; Fabian Diego Paredes Rivera; 64; 48; 30/04/1982; 30/04/2030; 6; 4(D); D6; Bajo; 4 Hora(s); Otros
PPL 447; 9665597794; Roberto Julian Cuenca Rivera; 44; 13; 13/07/2016; 13/07/2029; 5; 4(D); D7; Bajo; 4 Hora(s); Escandalo Publico
PPL 448; 9989140677; Dario Angel Torres Reyes; 57; 41; 01/12/1987; 01/12/2028; 4; 4(D); D8; Bajo; 4 Hora(s); Otros
PPL 449; 3498939783; Fabian Paulo Guerrero Roman; 48; 29; 20/12/1996; 20/12/2025; 1; 4(D); D9; Bajo; 4 Hora(s); Invacion de Propiedad Privada
PPL 450; 3955045661; Fabian Adrian Paredes Morales; 47; 16; 23/09/2010; 23/09/2026; 2; 4(D); D10; Bajo; 4 Hora(s); Invacion de Propiedad Privada
PPL 451; 6577889778; Dario Paulo Gonzales Ramirez; 45; 31; 12/12/1998; 12/12/2029; 5; 4(D); D11; Bajo; 4 Hora(s); Invacion de Propiedad Privada
PPL 452; 8476637453; Carlos Antonio Gonzales Morales; 57; 43; 08/05/1986; 08/05/2029; 5; 4(D); D12; Bajo; 4 Hora(s); Invacion de Propiedad Privada
PPL 453; 6220917852; Gonzalo Diego Guerrero Hidalgo; 63; 47; 30/02/1981; 30/02/2028; 4; 4(D); D13; Bajo; 4 Hora(s); Invacion de Propiedad Privada
PPL 454; 9174298018; Pedro Antonio Torres Reyes; 32; 15; 07/09/2011; 07/09/2026; 2; 4(D); D14; Bajo; 4 Hora(s); Escandalo Publico
PPL 455; 3461231494; Gonzalo Paulo Guerrero Morales; 34; 20; 26/02/2022; 26/02/2042; 18; 4(D); D15; Bajo; 4 Hora(s); Escandalo Publico
PPL 456; 8995548616; Gonzalo Julian Garcia Reyes; 54; 41; 18/05/1989; 18/05/2030; 6; 4(D); D16; Bajo; 4 Hora(s); Estafa
PPL 457; 3635177650; Fabian Julian Paredes Rivera; 46; 29; 20/06/2000; 20/06/2029; 5; 4(D); D17; Bajo; 4 Hora(s); Estafa
PPL 458; 2090542627; Roberto Antonio Romero Reyes; 42; 28; 23/11/2001; 23/11/2029; 5; 4(D); D18; Bajo; 4 Hora(s); Invacion de Propiedad Privada
PPL 459; 2280781990; Michael Cesar Garcia Rivera; 56; 43; 23/12/1987; 23/12/2030; 6; 4(D); D19; Bajo; 4 Hora(s); Otros
PPL 460; 2556179802; Carlos Sergio Perero Sanchez; 47; 27; 02/12/2001; 02/12/2028; 4; 4(D); D20; Bajo; 4 Hora(s); Estafa
PPL 461; 3355945202; Roberto Julian Torres Espinosa; 59; 45; 08/04/1984; 08/04/2029; 5; 4(D); D21; Bajo; 4 Hora(s); Escandalo Publico
PPL 462; 2002269076; Fabian Adrian Paredes Gomez; 59; 41; 28/08/1987; 28/08/2028; 4; 4(D); D22; Bajo; 4 Hora(s); Escandalo Publico
PPL 463; 8809062872; Roberto Paulo Perero Ramirez; 57; 40; 14/05/1986; 14/05/2026; 2; 4(D); D23; Bajo; 4 Hora(s); Invacion de Propiedad Privada
PPL 464; 8230295438; Victor Angel Perero Gomez; 34; 21; 27/08/2011; 27/08/2032; 8; 4(D); D24; Bajo; 4 Hora(s); Otros
PPL 465; 7805543493; Michael Paulo Cuenca Ramirez; 59; 39; 04/04/1987; 04/04/2026; 2; 4(D); D25; Bajo; 4 Hora(s); Estafa
PPL 466; 3517264309; Pedro Adrian Perero Sanchez; 42; 19; 14/06/2010; 14/06/2029; 5; 4(D); D26; Bajo; 4 Hora(s); Estafa
PPL 467; 9120351514; Fabian Angel Perero Roman; 47; 31; 27/06/1997; 27/06/2028; 4; 4(D); D27; Bajo; 4 Hora(s); Otros
PPL 468; 7475475559; Dario Antonio Torres Morales; 49; 34; 07/11/1994; 07/11/2028; 4; 4(D); D28; Bajo; 4 Hora(s); Otros
PPL 469; 2261423842; Victor Angel Cevallos Morales; 60; 47; 14/01/1983; 14/01/2030; 6; 4(D); D29; Bajo; 4 Hora(s); Otros
PPL 470; 3596360192; Mario Sergio Guerrero Rivera; 51; 36; 01/04/1992; 01/04/2028; 4; 4(D); D30; Bajo; 4 Hora(s); Estafa
PPL 471; 5452627629; Victor Adrian Perero Reyes; 34; 23; 21/07/2012; 21/07/2035; 11; 4(D); D31; Bajo; 4 Hora(s); Invacion de Propiedad Privada
PPL 472; 2314527813; Dario Cesar Guerrero Sanchez; 53; 37; 09/06/1990; 09/06/2027; 3; 4(D); D32; Bajo; 4 Hora(s); Estafa
PPL 473; 7498354292; Carlos Paulo Romero Rivera; 51; 35; 23/11/1995; 23/11/2030; 6; 4(D); D33; Bajo; 4 Hora(s); Invacion de Propiedad Privada
PPL 474; 2535490188; Roberto Antonio Gonzales Hidalgo; 57; 43; 26/04/1987; 26/04/2030; 6; 4(D); D34; Bajo; 4 Hora(s); Invacion de Propiedad Privada
PPL 475; 5320848976; Dario Diego Cuenca Reyes; 48; 28; 03/09/2013; 03/09/2041; 17; 4(D); D35; Bajo; 4 Hora(s); Estafa
PPL 476; 6220784497; Carlos Diego Paredes Gomez; 40; 24; 17/06/2005; 17/06/2029; 5; 4(D); D36; Bajo; 4 Hora(s); Otros
PPL 477; 1931958917; Fabian Paulo Cevallos Gomez; 64; 47; 26/10/1982; 26/10/2029; 5; 4(D); D37; Bajo; 4 Hora(s); Estafa
PPL 478; 5106446783; Pedro Cesar Paredes Espinosa; 43; 30; 15/01/2008; 15/01/2038; 14; 4(D); D38; Bajo; 4 Hora(s); Escandalo Publico
PPL 479; 4180621746; Dario Pablo Gonzales Ramirez; 61; 44; 07/10/1983; 07/10/2027; 3; 4(D); D39; Bajo; 4 Hora(s); Otros
PPL 480; 4066326140; Fabian Julian Cevallos Sanchez; 26; 24; 28/08/2024; 28/08/2048; 24; 4(D); D40; Bajo; 4 Hora(s); Otros
PPL 481; 6977167069; Mario Diego Cevallos Hidalgo; 64; 45; 04/04/1982; 04/04/2027; 3; 4(D); D41; Bajo; 4 Hora(s); Invacion de Propiedad Privada
PPL 482; 5279163746; Victor Julian Garcia Espinosa; 54; 34; 08/11/1992; 08/11/2026; 2; 4(D); D42; Bajo; 4 Hora(s); Escandalo Publico
PPL 483; 4195945838; Victor Antonio Romero Rivera; 41; 21; 13/06/2008; 13/06/2029; 5; 4(D); D43; Bajo; 4 Hora(s); Invacion de Propiedad Privada
PPL 484; 9846228359; Gonzalo Paulo Paredes Hidalgo; 38; 22; 26/05/2007; 26/05/2029; 5; 4(D); D44; Bajo; 4 Hora(s); Invacion de Propiedad Privada
PPL 485; 9879471920; Fabian Pablo Gonzales Ramirez; 44; 25; 26/03/2014; 26/03/2039; 15; 4(D); D45; Bajo; 4 Hora(s); Otros
PPL 486; 3272277645; Roberto Adrian Paredes Roman; 63; 49; 27/11/1980; 27/11/2029; 5; 4(D); D46; Bajo; 4 Hora(s); Otros
PPL 487; 5790685209; Fabian Antonio Romero Reyes; 55; 38; 26/09/1991; 26/09/2029; 5; 4(D); D47; Bajo; 4 Hora(s); Invacion de Propiedad Privada
PPL 488; 1744236309; Gonzalo Pablo Cuenca Rivera; 62; 48; 25/01/1981; 25/01/2029; 5; 4(D); D48; Bajo; 4 Hora(s); Otros
PPL 489; 4216361775; Dario Sergio Guerrero Espinosa; 28; 16; 20/03/2018; 20/03/2034; 10; 4(D); D49; Bajo; 4 Hora(s); Escandalo Publico
PPL 490; 6818738804; Pedro Cesar Romero Roman; 26; 29; 19/05/2020; 19/05/2049; 25; 4(D); D50; Bajo; 4 Hora(s); Invacion de Propiedad Privada
PPL 491; 1022978667; Gonzalo Pablo Cuenca Sanchez; 48; 29; 31/10/1998; 31/10/2027; 3; 4(D); D51; Bajo; 4 Hora(s); Estafa
PPL 492; 2910459016; Mario Diego Paredes Hidalgo; 65; 46; 03/08/1981; 03/08/2027; 3; 4(D); D52; Bajo; 4 Hora(s); Invacion de Propiedad Privada
PPL 493; 7037889354; Gonzalo Angel Cuenca Roman; 30; 21; 07/03/2015; 07/03/2036; 12; 4(D); D53; Bajo; 4 Hora(s); Escandalo Publico
PPL 494; 6827011776; Roberto Antonio Cuenca Rivera; 48; 32; 29/03/1995; 29/03/2027; 3; 4(D); D54; Bajo; 4 Hora(s); Estafa
PPL 495; 9081097258; Mario Antonio Romero Rivera; 32; 13; 19/07/2017; 19/07/2030; 6; 4(D); D55; Bajo; 4 Hora(s); Escandalo Publico
PPL 496; 1923094390; Carlos Antonio Garcia Roman; 39; 25; 01/01/2009; 01/01/2034; 10; 4(D); D56; Bajo; 4 Hora(s); Estafa
PPL 497; 3969986571; Roberto Antonio Paredes Sanchez; 46; 28; 25/04/1997; 25/04/2025; 1; 4(D); D57; Bajo; 4 Hora(s); Otros
PPL 498; 9972058714; Dario Cesar Paredes Morales; 43; 18; 03/12/2013; 03/12/2031; 7; 4(D); D58; Bajo; 4 Hora(s); Otros
PPL 499; 7238086834; Carlos Diego Cuenca Morales; 40; 21; 08/04/2016; 08/04/2037; 13; 4(D); D59; Bajo; 4 Hora(s); Otros
PPL 500; 3825840026; Michael Antonio Paredes Sanchez; 62; 47; 12/12/1983; 12/12/2030; 6; 4(D); D60; Bajo; 4 Hora(s); Invacion de Propiedad Privada
PPL 501; 1112855879; Michael Diego Garcia Reyes; 24; 13; 23/06/2021; 23/06/2034; 10; 4(D); D61; Bajo; 4 Hora(s); Invacion de Propiedad Privada
PPL 502; 5769591815; Mario Pablo Paredes Sanchez; 45; 29; 29/11/2000; 29/11/2029; 5; 4(D); D62; Bajo; 4 Hora(s); Otros
PPL 503; 9305118320; Victor Diego Guerrero Roman; 45; 31; 08/11/1998; 08/11/2029; 5; 4(D); D63; Bajo; 4 Hora(s); Invacion de Propiedad Privada
PPL 504; 9333357558; Victor Paulo Guerrero Espinosa; 47; 29; 17/10/1998; 17/10/2027; 3; 4(D); D64; Bajo; 4 Hora(s); Escandalo Publico
PPL 505; 4408330325; Roberto Julian Cevallos Sanchez; 27; 10; 24/06/2018; 24/06/2028; 4; 4(D); D65; Bajo; 4 Hora(s); Escandalo Publico
PPL 506; 9234583765; Fabian Sergio Romero Morales; 48; 23; 31/04/2005; 31/04/2028; 4; 4(D); D66; Bajo; 4 Hora(s); Escandalo Publico
PPL 507; 5264329329; Carlos Paulo Garcia Rivera; 38; 30; 13/01/2021; 13/01/2051; 27; 4(D); D67; Bajo; 4 Hora(s); Invacion de Propiedad Privada
PPL 508; 1355078806; Fabian Sergio Torres Morales; 58; 42; 28/09/1987; 28/09/2029; 5; 4(D); D68; Bajo; 4 Hora(s); Estafa
PPL 509; 1692627947; Roberto Antonio Cuenca Roman; 39; 21; 11/08/2005; 11/08/2026; 2; 4(D); D69; Bajo; 4 Hora(s); Otros
PPL 510; 7120956485; Pedro Antonio Paredes Ramirez; 40; 20; 03/11/2006; 03/11/2026; 2; 4(D); D70; Bajo; 4 Hora(s); Otros
PPL 511; 9612173163; Gonzalo Antonio Paredes Hidalgo; 48; 33; 25/11/1997; 25/11/2030; 6; 4(D); D71; Bajo; 4 Hora(s); Invacion de Propiedad Privada
PPL 512; 2231047746; Mario Pablo Cevallos Morales; 40; 16; 21/01/2013; 21/01/2029; 5; 4(D); D72; Bajo; 4 Hora(s); Escandalo Publico
PPL 513; 6878868421; Michael Antonio Perero Ramirez; 36; 13; 05/06/2013; 05/06/2026; 2; 4(D); D73; Bajo; 4 Hora(s); Escandalo Publico
PPL 514; 7408311867; Carlos Antonio Perero Morales; 53; 36; 11/11/1991; 11/11/2027; 3; 4(D); D74; Bajo; 4 Hora(s); Estafa
PPL 515; 8682855417; Pedro Paulo Garcia Sanchez; 58; 40; 17/07/1987; 17/07/2027; 3; 4(D); D75; Bajo; 4 Hora(s); Estafa
PPL 516; 6020982105; Victor Antonio Paredes Hidalgo; 32; 23; 25/01/2013; 25/01/2036; 12; 4(D); D76; Bajo; 4 Hora(s); Otros
PPL 517; 2713972123; Roberto Antonio Cuenca Roman; 38; 29; 08/12/2018; 08/12/2047; 23; 4(D); D77; Bajo; 4 Hora(s); Escandalo Publico
PPL 518; 6520280768; Fabian Adrian Perero Ramirez; 53; 35; 09/01/1992; 09/01/2027; 3; 4(D); D78; Bajo; 4 Hora(s); Invacion de Propiedad Privada
PPL 519; 4929619301; Victor Julian Torres Morales; 46; 30; 08/01/2017; 08/01/2047; 23; 4(D); D79; Bajo; 4 Hora(s); Escandalo Publico
PPL 520; 6914331225; Dario Sergio Paredes Espinosa; 61; 41; 16/07/1985; 16/07/2026; 2; 4(D); D80; Bajo; 4 Hora(s); Invacion de Propiedad Privada
PPL 521; 8244524874; Roberto Diego Perero Roman; 59; 40; 11/09/1987; 11/09/2027; 3; 4(D); D81; Bajo; 4 Hora(s); Invacion de Propiedad Privada
PPL 522; 6360817756; Michael Cesar Gonzales Sanchez; 52; 35; 16/08/1991; 16/08/2026; 2; 4(D); D82; Bajo; 4 Hora(s); Otros
PPL 523; 6993953385; Carlos Julian Cuenca Ramirez; 48; 26; 27/02/2014; 27/02/2040; 16; 4(D); D83; Bajo; 4 Hora(s); Invacion de Propiedad Privada
PPL 524; 4693791780; Michael Pablo Cuenca Rivera; 24; 12; 16/08/2019; 16/08/2031; 7; 4(D); D84; Bajo; 4 Hora(s); Estafa
PPL 525; 3819193381; Mario Julian Romero Ramirez; 63; 46; 05/11/1982; 05/11/2028; 4; 4(D); D85; Bajo; 4 Hora(s); Otros
PPL 526; 8283574896; Dario Adrian Paredes Sanchez; 34; 30; 28/01/2011; 28/01/2041; 17; 4(D); D86; Bajo; 4 Hora(s); Otros
PPL 527; 5864968569; Carlos Antonio Perero Sanchez; 36; 25; 18/02/2007; 18/02/2032; 8; 4(D); D87; Bajo; 4 Hora(s); Estafa
PPL 528; 5587520817; Carlos Sergio Perero Roman; 54; 36; 27/07/1991; 27/07/2027; 3; 4(D); D88; Bajo; 4 Hora(s); Estafa
PPL 529; 7335938467; Roberto Angel Perero Morales; 48; 32; 30/09/1995; 30/09/2027; 3; 4(D); D89; Bajo; 4 Hora(s); Invacion de Propiedad Privada
PPL 530; 3450484448; Gonzalo Antonio Cevallos Sanchez; 35; 10; 15/10/2017; 15/10/2027; 3; 4(D); D90; Bajo; 4 Hora(s); Otros
PPL 531; 6711364052; Carlos Diego Cevallos Reyes; 36; 15; 21/10/2010; 21/10/2025; 1; 4(D); D1; Bajo; 4 Hora(s); Otros
PPL 532; 3061494386; Gonzalo Sergio Torres Morales; 39; 27; 16/07/2012; 16/07/2039; 15; 4(D); D2; Bajo; 4 Hora(s); Otros
PPL 533; 3029788911; Dario Diego Romero Espinosa; 50; 36; 11/01/1993; 11/01/2029; 5; 4(D); D3; Bajo; 4 Hora(s); Estafa
PPL 534; 8332690250; Carlos Julian Romero Gomez; 60; 44; 16/05/1983; 16/05/2027; 3; 4(D); D4; Bajo; 4 Hora(s); Estafa
PPL 535; 8015683020; Michael Adrian Paredes Sanchez; 44; 25; 26/07/2003; 26/07/2028; 4; 4(D); D5; Bajo; 4 Hora(s); Otros
PPL 536; 6442744740; Mario Angel Guerrero Sanchez; 43; 18; 09/02/2008; 09/02/2026; 2; 4(D); D6; Bajo; 4 Hora(s); Otros
PPL 537; 2991655088; Fabian Paulo Perero Sanchez; 62; 49; 18/08/1981; 18/08/2030; 6; 4(D); D7; Bajo; 4 Hora(s); Estafa
PPL 538; 7134433423; Pedro Adrian Cuenca Hidalgo; 51; 31; 06/07/1995; 06/07/2026; 2; 4(D); D8; Bajo; 4 Hora(s); Escandalo Publico
PPL 539; 2099672372; Pedro Adrian Guerrero Roman; 37; 18; 21/04/2012; 21/04/2030; 6; 4(D); D9; Bajo; 4 Hora(s); Invacion de Propiedad Privada
PPL 540; 7317370453; Dario Antonio Romero Hidalgo; 45; 24; 11/12/2004; 11/12/2028; 4; 4(D); D10; Bajo; 4 Hora(s); Escandalo Publico
PPL 541; 1280161587; Mario Adrian Guerrero Roman; 34; 18; 04/12/2016; 04/12/2034; 10; 4(D); D11; Bajo; 4 Hora(s); Escandalo Publico
PPL 542; 7567175186; Carlos Angel Paredes Ramirez; 58; 43; 05/05/1985; 05/05/2028; 4; 4(D); D12; Bajo; 4 Hora(s); Estafa
PPL 543; 1299863586; Victor Sergio Romero Hidalgo; 25; 15; 17/07/2019; 17/07/2034; 10; 4(D); D13; Bajo; 4 Hora(s); Invacion de Propiedad Privada
PPL 544; 1150517272; Roberto Angel Perero Reyes; 55; 39; 13/12/1988; 13/12/2027; 3; 4(D); D14; Bajo; 4 Hora(s); Invacion de Propiedad Privada
PPL 545; 6212183483; Michael Antonio Torres Sanchez; 45; 23; 02/06/2024; 02/06/2047; 23; 4(D); D15; Bajo; 4 Hora(s); Estafa
PPL 546; 4181298586; Roberto Julian Paredes Gomez; 53; 38; 21/02/1990; 21/02/2028; 4; 4(D); D16; Bajo; 4 Hora(s); Escandalo Publico
PPL 547; 6201433080; Victor Angel Torres Roman; 35; 28; 19/07/2021; 19/07/2049; 25; 4(D); D17; Bajo; 4 Hora(s); Otros
PPL 548; 3629658197; Pedro Sergio Perero Ramirez; 55; 39; 26/12/1988; 26/12/2027; 3; 4(D); D18; Bajo; 4 Hora(s); Escandalo Publico
PPL 549; 5297388642; Gonzalo Sergio Gonzales Morales; 39; 16; 02/07/2011; 02/07/2027; 3; 4(D); D19; Bajo; 4 Hora(s); Estafa
PPL 550; 6125416973; Roberto Pablo Romero Sanchez; 47; 31; 09/01/1998; 09/01/2029; 5; 4(D); D20; Bajo; 4 Hora(s); Escandalo Publico
PPL 551; 5787584396; Mario Cesar Cuenca Ramirez; 49; 32; 02/09/1996; 02/09/2028; 4; 4(D); D21; Bajo; 4 Hora(s); Escandalo Publico
PPL 552; 3476496871; Victor Julian Guerrero Sanchez; 61; 47; 15/08/1982; 15/08/2029; 5; 4(D); D22; Bajo; 4 Hora(s); Escandalo Publico
PPL 553; 7861088126; Pedro Paulo Garcia Roman; 54; 37; 29/07/1991; 29/07/2028; 4; 4(D); D23; Bajo; 4 Hora(s); Otros
PPL 554; 9137416717; Victor Antonio Perero Gomez; 43; 30; 05/12/2000; 05/12/2030; 6; 4(D); D24; Bajo; 4 Hora(s); Escandalo Publico
PPL 555; 2498285350; Roberto Diego Romero Hidalgo; 54; 38; 17/06/1989; 17/06/2027; 3; 4(D); D25; Bajo; 4 Hora(s); Otros
PPL 556; 2971096501; Victor Pablo Cevallos Morales; 51; 37; 26/08/1993; 26/08/2030; 6; 4(D); D26; Bajo; 4 Hora(s); Invacion de Propiedad Privada
PPL 557; 6301150002; Victor Pablo Perero Morales; 43; 10; 18/10/2022; 18/10/2032; 8; 4(D); D27; Bajo; 4 Hora(s); Invacion de Propiedad Privada
PPL 558; 1060564361; Michael Antonio Perero Sanchez; 43; 26; 09/01/2003; 09/01/2029; 5; 4(D); D28; Bajo; 4 Hora(s); Otros
PPL 559; 3388178211; Pedro Julian Cevallos Ramirez; 62; 48; 18/11/1981; 18/11/2029; 5; 4(D); D29; Bajo; 4 Hora(s); Invacion de Propiedad Privada
PPL 560; 2336545079; Pedro Cesar Cuenca Sanchez; 60; 42; 10/02/1985; 10/02/2027; 3; 4(D); D30; Bajo; 4 Hora(s); Escandalo Publico
PPL 561; 5531014784; Fabian Antonio Perero Morales; 26; 21; 06/05/2018; 06/05/2039; 15; 4(D); D31; Bajo; 4 Hora(s); Escandalo Publico
PPL 562; 2327313228; Roberto Julian Garcia Sanchez; 32; 16; 26/06/2011; 26/06/2027; 3; 4(D); D32; Bajo; 4 Hora(s); Escandalo Publico
PPL 563; 1913110385; Michael Sergio Perero Roman; 52; 34; 15/01/1993; 15/01/2027; 3; 4(D); D33; Bajo; 4 Hora(s); Estafa
PPL 564; 2638592230; Carlos Julian Perero Ramirez; 66; 49; 14/02/1980; 14/02/2029; 5; 4(D); D34; Bajo; 4 Hora(s); Escandalo Publico
PPL 565; 2100652449; Victor Antonio Perero Reyes; 60; 43; 09/07/1986; 09/07/2029; 5; 4(D); D35; Bajo; 4 Hora(s); Otros
PPL 566; 9954145134; Michael Cesar Torres Sanchez; 63; 48; 20/02/1980; 20/02/2028; 4; 4(D); D36; Bajo; 4 Hora(s); Estafa
PPL 567; 4161958648; Mario Cesar Romero Espinosa; 34; 13; 23/08/2016; 23/08/2029; 5; 4(D); D37; Bajo; 4 Hora(s); Estafa
PPL 568; 4989564021; Pedro Antonio Paredes Sanchez; 42; 27; 07/05/2005; 07/05/2032; 8; 4(D); D38; Bajo; 4 Hora(s); Estafa
PPL 569; 3977683923; Mario Antonio Cuenca Gomez; 49; 21; 07/12/2022; 07/12/2043; 19; 4(D); D39; Bajo; 4 Hora(s); Otros
PPL 570; 4167634098; Roberto Cesar Cuenca Sanchez; 45; 27; 27/12/2001; 27/12/2028; 4; 4(D); D40; Bajo; 4 Hora(s); Escandalo Publico
PPL 571; 2425649325; Gonzalo Antonio Perero Morales; 38; 13; 09/02/2015; 09/02/2028; 4; 4(D); D41; Bajo; 4 Hora(s); Invacion de Propiedad Privada
PPL 572; 4122117333; Dario Angel Paredes Reyes; 38; 20; 03/06/2007; 03/06/2027; 3; 4(D); D42; Bajo; 4 Hora(s); Estafa
PPL 573; 4021862921; Roberto Adrian Romero Sanchez; 48; 32; 21/02/1996; 21/02/2028; 4; 4(D); D43; Bajo; 4 Hora(s); Estafa
PPL 574; 7843245530; Roberto Antonio Perero Espinosa; 36; 10; 21/10/2021; 21/10/2031; 7; 4(D); D44; Bajo; 4 Hora(s); Invacion de Propiedad Privada
PPL 575; 8487113322; Fabian Adrian Garcia Gomez; 45; 32; 28/12/1998; 28/12/2030; 6; 4(D); D45; Bajo; 4 Hora(s); Invacion de Propiedad Privada
PPL 576; 3678594064; Roberto Antonio Cuenca Hidalgo; 43; 29; 17/06/2000; 17/06/2029; 5; 4(D); D46; Bajo; 4 Hora(s); Otros
PPL 577; 2635545481; Carlos Diego Paredes Gomez; 43; 27; 18/03/2003; 18/03/2030; 6; 4(D); D47; Bajo; 4 Hora(s); Otros
PPL 578; 1975362203; Gonzalo Diego Paredes Rivera; 48; 11; 27/07/2017; 27/07/2028; 4; 4(D); D48; Bajo; 4 Hora(s); Estafa
PPL 579; 8977663082; Mario Julian Torres Reyes; 43; 25; 15/10/2002; 15/10/2027; 3; 4(D); D49; Bajo; 4 Hora(s); Otros
PPL 580; 1725730271; Mario Julian Cuenca Ramirez; 32; 17; 09/02/2012; 09/02/2029; 5; 4(D); D50; Bajo; 4 Hora(s); Invacion de Propiedad Privada
PPL 581; 6139957437; Pedro Cesar Cevallos Espinosa; 24; 22; 20/08/2020; 20/08/2042; 18; 4(D); D51; Bajo; 4 Hora(s); Estafa
PPL 582; 7219524232; Gonzalo Pablo Garcia Espinosa; 61; 44; 05/08/1982; 05/08/2026; 2; 4(D); D52; Bajo; 4 Hora(s); Invacion de Propiedad Privada
PPL 583; 4738853559; Michael Pablo Guerrero Rivera; 57; 43; 12/08/1986; 12/08/2029; 5; 4(D); D53; Bajo; 4 Hora(s); Estafa
PPL 584; 5377549462; Roberto Paulo Cevallos Espinosa; 51; 35; 01/06/1992; 01/06/2027; 3; 4(D); D54; Bajo; 4 Hora(s); Otros
PPL 585; 1754153002; Roberto Cesar Gonzales Rivera; 42; 22; 09/05/2006; 09/05/2028; 4; 4(D); D55; Bajo; 4 Hora(s); Otros
PPL 586; 4080131349; Roberto Cesar Cevallos Ramirez; 59; 44; 18/12/1985; 18/12/2029; 5; 4(D); D56; Bajo; 4 Hora(s); Otros
PPL 587; 1042352496; Victor Antonio Gonzales Sanchez; 47; 33; 26/12/1996; 26/12/2029; 5; 4(D); D57; Bajo; 4 Hora(s); Estafa
PPL 588; 9517126214; Gonzalo Antonio Gonzales Sanchez; 52; 36; 30/01/1994; 30/01/2030; 6; 4(D); D58; Bajo; 4 Hora(s); Escandalo Publico
PPL 589; 2413399987; Pedro Adrian Garcia Hidalgo; 40; 22; 10/09/2005; 10/09/2027; 3; 4(D); D59; Bajo; 4 Hora(s); Estafa
PPL 590; 6288637708; Dario Pablo Gonzales Gomez; 38; 24; 02/07/2005; 02/07/2029; 5; 4(D); D60; Bajo; 4 Hora(s); Otros
PPL 591; 6987254828; Michael Julian Paredes Morales; 37; 13; 30/02/2021; 30/02/2034; 10; 4(D); D61; Bajo; 4 Hora(s); Otros
PPL 592; 3008945900; Michael Diego Perero Sanchez; 41; 23; 28/08/2004; 28/08/2027; 3; 4(D); D62; Bajo; 4 Hora(s); Estafa
PPL 593; 4626248641; Mario Angel Torres Rivera; 36; 16; 07/02/2010; 07/02/2026; 2; 4(D); D63; Bajo; 4 Hora(s); Invacion de Propiedad Privada
PPL 594; 9500413783; Dario Antonio Cuenca Roman; 49; 36; 06/04/1994; 06/04/2030; 6; 4(D); D64; Bajo; 4 Hora(s); Invacion de Propiedad Privada
PPL 595; 5536011522; Fabian Pablo Cuenca Gomez; 61; 44; 03/10/1982; 03/10/2026; 2; 4(D); D65; Bajo; 4 Hora(s); Invacion de Propiedad Privada
PPL 596; 4967712586; Gonzalo Paulo Perero Gomez; 37; 25; 11/12/2012; 11/12/2037; 13; 4(D); D66; Bajo; 4 Hora(s); Invacion de Propiedad Privada
PPL 597; 2163636020; Fabian Antonio Torres Ramirez; 45; 28; 22/02/2001; 22/02/2029; 5; 4(D); D67; Bajo; 4 Hora(s); Otros
PPL 598; 8220540745; Michael Antonio Paredes Hidalgo; 52; 38; 18/12/1991; 18/12/2029; 5; 4(D); D68; Bajo; 4 Hora(s); Estafa
PPL 599; 2064594366; Roberto Cesar Gonzales Sanchez; 55; 38; 15/11/1988; 15/11/2026; 2; 4(D); D69; Bajo; 4 Hora(s); Estafa
PPL 600; 9765734280; Gonzalo Pablo Garcia Espinosa; 36; 28; 27/12/2007; 27/12/2035; 11; 4(D); D70; Bajo; 4 Hora(s); Invacion de Propiedad Privada
PPL 601; 2394746705; Roberto Cesar Guerrero Rivera; 49; 6; 10/08/2021; 10/08/2027; 3; 4(D); D71; Bajo; 4 Hora(s); Escandalo Publico
PPL 602; 5812495514; Dario Diego Perero Roman; 59; 43; 24/08/1985; 24/08/2028; 4; 4(D); D72; Bajo; 4 Hora(s); Estafa
PPL 603; 9269559529; Pedro Adrian Guerrero Hidalgo; 52; 38; 15/07/1991; 15/07/2029; 5; 4(D); D73; Bajo; 4 Hora(s); Estafa
PPL 604; 1023693581; Victor Sergio Gonzales Sanchez; 48; 14; 02/02/2015; 02/02/2029; 5; 4(D); D74; Bajo; 4 Hora(s); Otros
PPL 605; 3355516909; Pedro Angel Perero Sanchez; 43; 25; 17/01/2009; 17/01/2034; 10; 4(D); D75; Bajo; 4 Hora(s); Otros
PPL 606; 7773428028; Michael Pablo Cuenca Ramirez; 49; 29; 04/11/2004; 04/11/2033; 9; 4(D); D76; Bajo; 4 Hora(s); Escandalo Publico
PPL 607; 8732519100; Michael Antonio Paredes Hidalgo; 63; 44; 25/11/1982; 25/11/2026; 2; 4(D); D77; Bajo; 4 Hora(s); Escandalo Publico
PPL 608; 7873557130; Michael Angel Garcia Ramirez; 57; 44; 14/05/1986; 14/05/2030; 6; 4(D); D78; Bajo; 4 Hora(s); Otros
PPL 609; 9013199392; Pedro Cesar Garcia Sanchez; 39; 17; 08/06/2012; 08/06/2029; 5; 4(D); D79; Bajo; 4 Hora(s); Otros
PPL 610; 8726374600; Michael Sergio Garcia Hidalgo; 46; 21; 11/11/2018; 11/11/2039; 15; 4(D); D80; Bajo; 4 Hora(s); Invacion de Propiedad Privada
PPL 611; 3773886837; Michael Angel Cevallos Ramirez; 47; 30; 10/10/1997; 10/10/2027; 3; 4(D); D81; Bajo; 4 Hora(s); Otros
PPL 612; 7837118602; Roberto Antonio Guerrero Roman; 30; 19; 05/05/2013; 05/05/2032; 8; 4(D); D82; Bajo; 4 Hora(s); Invacion de Propiedad Privada
PPL 613; 9273598415; Roberto Pablo Cevallos Sanchez; 31; 28; 08/09/2012; 08/09/2040; 16; 4(D); D83; Bajo; 4 Hora(s); Invacion de Propiedad Privada
PPL 614; 3856621205; Victor Pablo Gonzales Hidalgo; 47; 34; 18/04/1996; 18/04/2030; 6; 4(D); D84; Bajo; 4 Hora(s); Escandalo Publico
PPL 615; 1168381077; Pedro Pablo Torres Rivera; 66; 48; 24/01/1980; 24/01/2028; 4; 4(D); D85; Bajo; 4 Hora(s); Otros
PPL 616; 5509291453; Roberto Julian Perero Rivera; 44; 28; 18/09/2002; 18/09/2030; 6; 4(D); D86; Bajo; 4 Hora(s); Estafa
